{
  "id": "session-api",
  "version": "1.0.0",
  "api_version": 1,
  "execution": {
    "mode": "module",
    "runtimes": [
      "node",
      "bun"
    ],
    "entry": "./dist/index.js"
  },
  "lifecycle": {
    "scope": "host"
  },
  "sandbox": {
    "enabled": false,
    "filesystem": [],
    "network": "none"
  },
  "references": [
    [
      "runtime",
      "session_runtime"
    ]
  ],
  "apis": [
    {
      "id": 1,
      "name": "register_session",
      "input": {
        "type": "object",
        "additionalProperties": false,
        "required": [
          "runtime_id",
          "command_id",
          "config"
        ],
        "properties": {
          "runtime_id": {
            "x-hh-type": "uint64-positive"
          },
          "command_id": {
            "x-hh-type": "uint64-positive"
          },
          "config": {
            "$ref": "#/$defs/session_config"
          }
        },
        "$defs": {
          "session_config": {
            "type": "object",
            "required": [
              "api_key_raw",
              "history",
              "session_current",
              "tool_definitions",
              "provider",
              "endpoint",
              "model_id",
              "context_limit",
              "compact_threshold",
              "tool_result_timeout_ms",
              "session_timeout_ms",
              "compaction_prompt",
              "workspace_path",
              "tool_runtime_executable",
              "sandbox_config",
              "refresh_workspace"
            ],
            "properties": {
              "api_key_raw": {
                "type": "string",
                "minLength": 1
              },
              "history": {
                "type": "array"
              },
              "session_current": {
                "type": "object",
                "required": [
                  "messages"
                ],
                "properties": {
                  "messages": {
                    "type": "array",
                    "minItems": 1
                  },
                  "tools": false
                }
              },
              "tool_definitions": {
                "type": "array"
              },
              "provider": {
                "enum": [
                  "openai",
                  "deepseek",
                  "bonsai"
                ]
              },
              "endpoint": {
                "type": "string",
                "minLength": 1
              },
              "model_id": {
                "type": "string",
                "minLength": 1
              },
              "context_limit": {
                "x-hh-type": "uint64-positive"
              },
              "compact_threshold": {
                "x-hh-type": "uint64"
              },
              "tool_result_timeout_ms": {
                "anyOf": [
                  {
                    "const": -1
                  },
                  {
                    "type": "integer",
                    "minimum": 1,
                    "maximum": 2147483647
                  }
                ]
              },
              "session_timeout_ms": {
                "anyOf": [
                  {
                    "const": -1
                  },
                  {
                    "type": "integer",
                    "minimum": 1,
                    "maximum": 2147483647
                  }
                ]
              },
              "compaction_prompt": {
                "type": "string"
              },
              "workspace_path": {
                "type": "string",
                "minLength": 1
              },
              "tool_runtime_executable": {
                "type": "string",
                "minLength": 1
              },
              "sandbox_config": {
                "type": "object",
                "required": [
                  "read_only",
                  "read_write",
                  "network"
                ],
                "properties": {
                  "read_only": {
                    "type": "array",
                    "items": {
                      "type": "string"
                    }
                  },
                  "read_write": {
                    "type": "array",
                    "items": {
                      "type": "string"
                    }
                  },
                  "network": {
                    "enum": [
                      "none",
                      "internet_client"
                    ]
                  }
                }
              },
              "refresh_workspace": {
                "type": "boolean"
              }
            }
          }
        }
      },
      "output": {
        "oneOf": [
          {
            "type": "object",
            "additionalProperties": false,
            "required": [
              "value",
              "error"
            ],
            "properties": {
              "value": {
                "type": "object",
                "additionalProperties": false,
                "required": [
                  "command_id",
                  "state",
                  "result"
                ],
                "properties": {
                  "command_id": {
                    "x-hh-type": "uint64-positive"
                  },
                  "state": {
                    "type": "string"
                  },
                  "result": {}
                }
              },
              "error": {
                "type": "null"
              }
            }
          },
          {
            "type": "object",
            "additionalProperties": false,
            "required": [
              "value",
              "error"
            ],
            "properties": {
              "value": {
                "type": "null"
              },
              "error": {
                "$ref": "#/$defs/hh_error"
              }
            }
          }
        ],
        "$defs": {
          "hh_error": {
            "type": "object",
            "additionalProperties": false,
            "required": [
              "source",
              "operation",
              "type",
              "message",
              "data",
              "causes"
            ],
            "properties": {
              "source": {
                "type": "string"
              },
              "operation": {
                "type": "string"
              },
              "type": {
                "type": "string"
              },
              "message": {
                "type": "string"
              },
              "data": {
                "type": "array",
                "items": true
              },
              "causes": {
                "type": "array",
                "items": {
                  "$ref": "#/$defs/hh_error"
                }
              }
            }
          }
        }
      }
    },
    {
      "id": 2,
      "name": "declare_request",
      "input": {
        "type": "object",
        "additionalProperties": false,
        "required": [
          "runtime_id",
          "command_id"
        ],
        "properties": {
          "runtime_id": {
            "x-hh-type": "uint64-positive"
          },
          "command_id": {
            "x-hh-type": "uint64-positive"
          }
        }
      },
      "output": {
        "oneOf": [
          {
            "type": "object",
            "additionalProperties": false,
            "required": [
              "value",
              "error"
            ],
            "properties": {
              "value": {
                "type": "object",
                "additionalProperties": false,
                "required": [
                  "command_id",
                  "state",
                  "result"
                ],
                "properties": {
                  "command_id": {
                    "x-hh-type": "uint64-positive"
                  },
                  "state": {
                    "type": "string"
                  },
                  "result": {}
                }
              },
              "error": {
                "type": "null"
              }
            }
          },
          {
            "type": "object",
            "additionalProperties": false,
            "required": [
              "value",
              "error"
            ],
            "properties": {
              "value": {
                "type": "null"
              },
              "error": {
                "$ref": "#/$defs/hh_error"
              }
            }
          }
        ],
        "$defs": {
          "hh_error": {
            "type": "object",
            "additionalProperties": false,
            "required": [
              "source",
              "operation",
              "type",
              "message",
              "data",
              "causes"
            ],
            "properties": {
              "source": {
                "type": "string"
              },
              "operation": {
                "type": "string"
              },
              "type": {
                "type": "string"
              },
              "message": {
                "type": "string"
              },
              "data": {
                "type": "array",
                "items": true
              },
              "causes": {
                "type": "array",
                "items": {
                  "$ref": "#/$defs/hh_error"
                }
              }
            }
          }
        }
      }
    },
    {
      "id": 3,
      "name": "run_request",
      "input": {
        "type": "object",
        "additionalProperties": false,
        "required": [
          "runtime_id",
          "command_id"
        ],
        "properties": {
          "runtime_id": {
            "x-hh-type": "uint64-positive"
          },
          "command_id": {
            "x-hh-type": "uint64-positive"
          }